title,description,category,fileUrl,uploadedAt
Leave Application Form,Standard leave request form for all staff — submit to manager then HR,HR & Leave,https://sharepoint.ndma.gov.gh/forms/leave-application-form-v2.pdf,2025-01-10T09:00:00
Overtime Request Form,Request form for pre-approved overtime hours including callout compensation,HR & Leave,https://sharepoint.ndma.gov.gh/forms/overtime-request-form-v1.pdf,2024-08-01T09:00:00
Procurement Request Form,Internal requisition form for equipment and supplies,Finance,https://sharepoint.ndma.gov.gh/forms/procurement-request-form-v3.pdf,2025-02-14T09:00:00
IT Support Request Form,Helpdesk request form for IT issues not logged in iTop,IT,https://sharepoint.ndma.gov.gh/forms/it-support-request-v1.pdf,2024-06-01T09:00:00
Incident Report Form,Post-incident report form for critical or high severity incidents,Operations,https://sharepoint.ndma.gov.gh/forms/incident-report-form-v2.pdf,2025-01-20T09:00:00
Staff Change of Details Form,Form for staff to update personal contact information with HR,General,https://sharepoint.ndma.gov.gh/forms/change-of-details-v1.pdf,2024-03-15T09:00:00
